id,state,name of top subreddit,upvote_ratio,upvotes,num_comments,Topic 1,Topic 2,Topic 3
9001,Alabama,Small-town police sued for planting drugs on drivers in north Alabama,0.99,5166,180,0_alabama_state_library_al,1_tuberville_tommy_senator_nominations,
24501,Alaska,My drive to work yesterday,0.99,3795,159,-1_sexual_reddit_news_state,0_moving_anchorage_snow_glacier,1_amp_format_webp_redd
21001,Arizona,Arizona to end deal with Saudi farms sucking state water dry,0.97,15965,498,-1_event_heat_night_phoenix,0_canyon_creek_grand_lake,1_trump_election_gop_electors
13001,Arkansas,White House Twitter account calls out our two senators for celebrating projects funded by the bill they voted against,0.98,7556,269,-1_janikka_told_walmart_bradford,0_sanders_huckabee_gov_podium,1_https_arrested_edu_sheriff
23001,California,"'Pretty staggering': Thousands of California police officers could be stripped of their badges under new law — California’s police standards commission is bracing to decertify or suspend 3,000 to 3,500 police officers each year for serious misconduct under a new state law",0.95,22567,1155,-1_oil_beach_traffic_wage,0_lake_drought_hurricane_flooding,1_feinstein_senate_voters_republicans
19501,Colorado,This view never gets old.,0.98,3613,167,-1_mountain_rocky_home_boulder,0_drought_canyon_project_dinosaur,1_marijuana_legislature_cannabis_psychedelics
3001,Connecticut,My brother passed away today.,0.95,1644,194,-1_today_ticks_museum_transgender,0_connecticut_ct_profit_states,1_cars_driving_traffic_lane
4001,Delaware,Woah now,0.96,1870,746,-1_doug_land_com_castle,0_delaware_state_marijuana_states,1_wilmington_deer_blackbird_forest
8501,Florida,Wtf Florida. 4:45 AM.,0.92,17034,1983,-1_https_pool_reporting_kids,0_beach_lived_home_storm,1_ron_desantis_campaign_biden
8001,Georgia,"Georgia ranked worst state for health care, study finds",0.98,2434,316,-1_children_job_housing_cameras,0_walk_amp_atlanta_ga,1_victim_cop_police_videos
25001,Hawaii,I’m a little tired of how I’m seeing this disaster framed,0.92,2058,293,-1_beach_maui_waipahu_hawaii,0_shark_hawaii_hawaiian_surfer,1_driving_rail_parking_pedestrian
22001,Idaho,"A real photo of Heather Scott, a woman who should not hold office in the state of Idaho",0.94,4064,715,-1_going_com_spanish_https,0_abortion_mortality_maternal_law,1_towns_houses_south_farms
14001,Illinois,"Sen. John Kennedy (R-LA): “Why do you think that Chicago has become America's largest outdoor shooting range?” Dr. Megan Ranney of the Yale School of Public Health: “Mississippi, Louisiana, and Missouri actually have higher firearm death rates.”",0.95,4562,127,-1_healthcare_million_care_solar,0_illinois_state_chicago_town,1_pritzker_signs_governor_nuclear
11501,Indiana,Visiting Mishawaka this week as my dad recovers from back surgery. I came across this lovely display on a bike ride. I'm past the disappointment phase. 😂 I just feel truly sad for these individuals at this point.,0.9,3477,940,-1_gary_todd_state_daylight,0_cannabis_marijuana_legalization_hemp,1_unemployment_wages_employers_skills
14501,Iowa,We have a politician trending again...,0.96,4402,601,-1_abortion_state_anthem_news,0_vote_iowa_gop_lived,1_power_sub_mad_mistakes
17001,kansas,Farmer surprises wife with 80 acres of sunflowers for 50th wedding anniversary,0.99,6791,491,-1_foster_lgbtq_bills_library,0_town_day_walking_walk,1_police_judge_patrol_copies
10501,Kentucky,"Associated Press: ""Democratic Gov. Andy Beshear reelected to second term in Kentucky, overcoming state’s GOP dominance""",0.97,2634,225,-1_veterans_bets_insurance_patton,0_ky_kentucky_walking_louisville,1_county_madison_abandoned_clay
12501,Louisiana,Moms For Liberty - East Baton Rouge Parish is now listed as a hate group by the Southern Poverty Law Center.,0.92,11611,961,-1_infant_rates_prison_mortality,0_worst_orleans_lake_live,1_landry_jeff_ag_immigration
501,Maine,2 Active Shooter incidents in Lewiston,0.92,9742,12309,-1_alex_portland_leo_leonard,0_lewiston_com_shooting_victims,1_maine_hike_massachusetts_kitty
4501,Maryland,Please get off my ass,0.93,9592,907,-1_city_homes_baltimore_movers,0_bay_miss_maryland_chesapeake,1_abortion_law_congress_recreational
2001,Massachusetts,States in America where gay marriage was legal 15 years ago,0.94,2926,142,-1_amp_flag_information_students,0_ma_massachusetts_springfield_towns,1_massachusetts_ban_marijuana_psychedelics
12001,Michigan,The Satanic Temple congregations set up Yule Goat at Michigan Capitol,0.91,8223,1000,-1_jewish_colleagues_hamas_neighbors,0_michigan_whitmer_detroit_trump,1_satanic_capitol_temple_congregations
15501,Minnesota,It's official: Minnesota is the 23rd state to legalize recreational marijuana,0.92,28608,1274,-1_contact_uber_niagara_bottling,0_minnesota_state_mn_states,1_flag_star_revisions_committee
10001,Mississippi,Maybe I’m out of the loop…,0.95,3985,676,-1_obtain_police_cops_ms,0_mississippi_presley_reeves_tate,1_arrested_amp_png_police
13501,Missouri,I'm a Republican. And I Cannot Vote For Trump,0.66,36908,4575,-1_basye_webber_bar_rural,0_transgender_trans_gender_minors,1_ozarks_trail_river_kc
20501,Montana,Restaurant’s sushi roll blamed for poisoning 41 and killing 2 in Montana,0.97,1132,454,-1_amp_gt_bridge_charge,0_montana_state_butte_city,1_lake_glacier_creek_hike
17501,Nebraska,Brain Drain,0.85,18411,1086,-1_lincoln_crime_sen_nebraska,0_omaha_nebraskans_nebraska_visit,1_abortion_ban_abortions_congress
22501,Nevada,Nevada Is Investigating the 2020 Fake Trump Electors Scheme,0.96,1991,96,-1_fisher_stadium_oakland_mlb,0_primary_election_electors_ballot,1_ely_trip_road_lake
1001,New Hampshire,Should New Hampshire follow?,0.95,11054,1153,-1_sam_truck_hampshire_day,0_marijuana_republicans_legalize_senate,1_lake_turtles_beach_winnipesaukee
3501,New Jersey,New Jersey Governor Declares State a 'Safe Haven' for Gender-Affirming Care,0.89,2485,297,0_jersey_nj_state_time,1_kim_menendez_senator_murphy,
19001,New Mexico,Navajo president drops in at new skatepark in the Navajo Nation!,1,3672,142,-1_university_albuquerque_humanitarian_research,0_chile_red_spanish_mexican,1_gila_wilderness_mountains_canyon
1,New York,Democrats overtake Monroe County Legislature for first time in nearly three decades,0.96,1991,90,-1_amp_png_https_preview,0_employees_law_tax_divorce,1_recommendations_places_trip_upstate
7001,North Carolina,"After I said that the angriest voices in Congress are faking their anger just to get onto certain news shows, this news show decided to prove the point. - Rep. Jeff Jackson",0.9,84530,2963,-1_public_gender_schools_robinson,0_beach_north_cars_raleigh,1_jackson_speaker_amendment_debt
18501,North Dakota,Republican North Dakota state senator Ray Holmberg has been indicted for possessing child porn and for traveling to the Czech Republic from 2011-2016 to rape women under 18. He is a Christian Nationalist and is ND's longest-serving state senator in history.,0.96,10825,520,-1_workers_jamestown_job_000,0_employment_unemployment_dakota_north,1_fargo_comedy_events_cellar
11001,Ohio,The governor right now 😝,0.91,20875,1795,-1_trump_amendment_election_ballot,0_weather_snow_pictures_lake,1_marijuana_legalization_recreational_cannabis
16501,Oklahoma,Oklahoma’s Abortion Ban Forced Woman to Spend Thousands to Travel to New Mexico for Life-Saving Care,0.95,2829,381,-1_plan_internet_mbps_mullin,0_city_park_restaurant_moved,1_charter_schools_catholic_public
23501,Oregon,I am so jealous of Colorado right now,0.86,17570,1982,-1_amp_salem_state_000,0_meek_umatilla_plague_tribe,1_observatory_views_forest_butte
6001,Pennsylvania,If I were a congressmen I would wear the exact same outfits as Fetterman,0.88,5605,1019,0_pennsylvania_pa_state_county,1_fetterman_menendez_senator_committee,
2501,Rhode Island,Spotted at Lincoln Woods,0.96,886,442,-1_spotify_playlist_dogs_news,0_beach_painting_narragansett_newport,1_rhode_island_states_percent
7501,South Carolina,"Lindsay Graham, You have been in the Senate for 20 f**king years and we have never seen any actual legislation from you specifying what border and immigration actions you want. All you do is bitch, complain and vote against legislation.",0.95,2219,253,-1_scott_tim_cancer_fees,0_charleston_beach_myrtle_walking,1_pastor_arrested_prison_rcsd
18001,South Dakota,BREAKING: MAGA Governor Kristi Noem is embroiled in a seedy scandal as it's revealed that she has been having an extramarital affair with top Trump advisor Corey Lewandowski — who is also married and is an alleged sexual predator.,0.94,6692,397,-1_sioux_com_state_dakota,0_lewandowski_corey_affair_trump,1_cannabis_legalization_ballot_petition
9501,Tennessee,"Allie Phillips, a Clarksville woman whose story of pregnancy loss under Tennessee's abortion ban drew national attention, is running for the state House.",0.98,5877,109,-1_manifesto_book_children_blackburn,0_preview_width_format_area,1_abortion_lawsuit_lee_pregnancy
16001,Texas,Texas Representative Dan Crenshaw failed in his boycott attempt of Bud Light by posting a video of his fridge full of Karbach – which is owned by the same company.,0.91,33750,1416,-1_kids_border_campaign_indoctrination,0_police_shooting_arrest_mccauley,1_schools_public_teachers_voucher
21501,Utah,Utah’s ridiculous porn laws in action.,0.93,2401,503,0_utah_state_lake_salt,1_flag_pride_flags_lgbtq,
1501,Vermont,You’ll never believe this,0.99,1302,98,-1_peeped_14_montpelier_10,0_vermont_lived_burlington_places,1_road_truck_driving_headlights
6501,Virginia,What could go wrong?,0.94,8686,726,-1_com_americanindependent_tiktok_campaign,0_want_road_map_traffic,1_teacher_queer_books_policies
24001,Washington,New State Flag idea,0.87,3608,508,-1_tribes_deli_sunrise_yellow,0_tax_office_ballot_governor,1_cascades_highway_glaciers_glacier
5501,West Virginia,r/leopardsatemyface unleash the hate on the folks dead and dying in Indian Creek. But they've got some points.,0.93,1686,353,-1_reddit_stop_https_com,0_roads_pa_county_morgantown,1_virginia_debt_kennedy_marvel
15001,Wisconsin,"In 4-3 ruling, Wisconsin Supreme Court orders new legislative maps before 2024 election",0.96,6855,410,-1_baldwin_wisconsin_www_state,0_wi_snow_culver_highway,1_johnson_electors_fake_trump
20001,Wyoming,"The woman who torched Wyoming's lone, full-service abortion clinic is about to be sentenced",0.94,2278,120,-1_texas_border_federal_summer,0_photo_pic_amp_wyomingest,1_accent_youtu_midwest_brokeback